
         /\      Grafana   /‾‾/  
    /\  /  \     |\  __   /  /   
   /  \/    \    | |/ /  /   ‾‾\ 
  /          \   |   (  |  (‾)  |
 / __________ \  |_|\_\  \_____/ 

     execution: local
        script: k6.test.js
        output: -

     scenarios: (100.00%) 1 scenario, 100 max VUs, 2m30s max duration (incl. graceful stop):
              * default: Up to 100 looping VUs for 2m0s over 4 stages (gracefulRampDown: 30s, gracefulStop: 30s)


running (0m01.0s), 001/100 VUs, 0 complete and 0 interrupted iterations
default   [   1% ] 001/100 VUs  0m01.0s/2m00.0s

running (0m02.0s), 001/100 VUs, 1 complete and 0 interrupted iterations
default   [   2% ] 001/100 VUs  0m02.0s/2m00.0s

running (0m03.0s), 001/100 VUs, 2 complete and 0 interrupted iterations
default   [   2% ] 001/100 VUs  0m03.0s/2m00.0s

running (0m03.9s), 002/100 VUs, 3 complete and 0 interrupted iterations
default   [   3% ] 002/100 VUs  0m03.9s/2m00.0s

running (0m04.0s), 002/100 VUs, 3 complete and 0 interrupted iterations
default   [   3% ] 002/100 VUs  0m04.0s/2m00.0s

running (0m05.0s), 002/100 VUs, 5 complete and 0 interrupted iterations
default   [   4% ] 002/100 VUs  0m05.0s/2m00.0s

running (0m06.0s), 002/100 VUs, 7 complete and 0 interrupted iterations
default   [   5% ] 002/100 VUs  0m06.0s/2m00.0s

running (0m07.0s), 003/100 VUs, 9 complete and 0 interrupted iterations
default   [   6% ] 003/100 VUs  0m07.0s/2m00.0s

running (0m08.0s), 003/100 VUs, 12 complete and 0 interrupted iterations
default   [   7% ] 003/100 VUs  0m08.0s/2m00.0s

running (0m09.0s), 003/100 VUs, 12 complete and 0 interrupted iterations
default   [   7% ] 003/100 VUs  0m09.0s/2m00.0s

running (0m10.0s), 003/100 VUs, 15 complete and 0 interrupted iterations
default   [   8% ] 003/100 VUs  0m10.0s/2m00.0s

running (0m11.0s), 004/100 VUs, 18 complete and 0 interrupted iterations
default   [   9% ] 004/100 VUs  0m11.0s/2m00.0s

running (0m12.0s), 004/100 VUs, 22 complete and 0 interrupted iterations
default   [  10% ] 004/100 VUs  0m12.0s/2m00.0s

running (0m13.0s), 004/100 VUs, 26 complete and 0 interrupted iterations
default   [  11% ] 004/100 VUs  0m13.0s/2m00.0s

running (0m14.0s), 005/100 VUs, 30 complete and 0 interrupted iterations
default   [  12% ] 005/100 VUs  0m14.0s/2m00.0s

running (0m15.0s), 005/100 VUs, 33 complete and 0 interrupted iterations
default   [  12% ] 005/100 VUs  0m15.0s/2m00.0s

running (0m16.0s), 005/100 VUs, 38 complete and 0 interrupted iterations
default   [  13% ] 005/100 VUs  0m16.0s/2m00.0s

running (0m17.0s), 006/100 VUs, 43 complete and 0 interrupted iterations
default   [  14% ] 006/100 VUs  0m17.0s/2m00.0s

running (0m18.0s), 006/100 VUs, 46 complete and 0 interrupted iterations
default   [  15% ] 006/100 VUs  0m18.0s/2m00.0s

running (0m19.0s), 006/100 VUs, 52 complete and 0 interrupted iterations
default   [  16% ] 006/100 VUs  0m19.0s/2m00.0s

running (0m20.0s), 006/100 VUs, 58 complete and 0 interrupted iterations
default   [  17% ] 006/100 VUs  0m20.0s/2m00.0s

running (0m21.0s), 007/100 VUs, 63 complete and 0 interrupted iterations
default   [  17% ] 007/100 VUs  0m21.0s/2m00.0s

running (0m22.0s), 007/100 VUs, 70 complete and 0 interrupted iterations
default   [  18% ] 007/100 VUs  0m22.0s/2m00.0s

running (0m23.0s), 007/100 VUs, 75 complete and 0 interrupted iterations
default   [  19% ] 007/100 VUs  0m23.0s/2m00.0s

running (0m24.0s), 008/100 VUs, 82 complete and 0 interrupted iterations
default   [  20% ] 008/100 VUs  0m24.0s/2m00.0s

running (0m25.0s), 008/100 VUs, 88 complete and 0 interrupted iterations
default   [  21% ] 008/100 VUs  0m25.0s/2m00.0s

running (0m26.0s), 008/100 VUs, 96 complete and 0 interrupted iterations
default   [  22% ] 008/100 VUs  0m26.0s/2m00.0s

running (0m27.0s), 009/100 VUs, 102 complete and 0 interrupted iterations
default   [  22% ] 009/100 VUs  0m27.0s/2m00.0s

running (0m28.0s), 009/100 VUs, 110 complete and 0 interrupted iterations
default   [  23% ] 009/100 VUs  0m28.0s/2m00.0s

running (0m29.0s), 009/100 VUs, 119 complete and 0 interrupted iterations
default   [  24% ] 009/100 VUs  0m29.0s/2m00.0s

running (0m30.0s), 009/100 VUs, 126 complete and 0 interrupted iterations
default   [  25% ] 009/100 VUs  0m30.0s/2m00.0s

running (0m31.0s), 011/100 VUs, 135 complete and 0 interrupted iterations
default   [  26% ] 011/100 VUs  0m31.0s/2m00.0s

running (0m32.0s), 012/100 VUs, 144 complete and 0 interrupted iterations
default   [  27% ] 012/100 VUs  0m32.0s/2m00.0s

running (0m33.0s), 013/100 VUs, 151 complete and 0 interrupted iterations
default   [  27% ] 013/100 VUs  0m33.0s/2m00.0s

running (0m34.0s), 015/100 VUs, 164 complete and 0 interrupted iterations
default   [  28% ] 015/100 VUs  0m34.0s/2m00.0s

running (0m35.0s), 016/100 VUs, 173 complete and 0 interrupted iterations
default   [  29% ] 016/100 VUs  0m35.0s/2m00.0s

running (0m36.0s), 017/100 VUs, 184 complete and 0 interrupted iterations
default   [  30% ] 017/100 VUs  0m36.0s/2m00.0s

running (0m37.0s), 019/100 VUs, 192 complete and 0 interrupted iterations
default   [  31% ] 019/100 VUs  0m37.0s/2m00.0s

running (0m38.0s), 020/100 VUs, 205 complete and 0 interrupted iterations
default   [  32% ] 020/100 VUs  0m38.0s/2m00.0s

running (0m39.0s), 021/100 VUs, 213 complete and 0 interrupted iterations
default   [  32% ] 021/100 VUs  0m39.0s/2m00.0s

running (0m40.0s), 023/100 VUs, 224 complete and 0 interrupted iterations
default   [  33% ] 023/100 VUs  0m40.0s/2m00.0s

running (0m41.0s), 024/100 VUs, 237 complete and 0 interrupted iterations
default   [  34% ] 024/100 VUs  0m41.0s/2m00.0s

running (0m42.0s), 025/100 VUs, 242 complete and 0 interrupted iterations
default   [  35% ] 025/100 VUs  0m42.0s/2m00.0s

running (0m43.0s), 027/100 VUs, 254 complete and 0 interrupted iterations
default   [  36% ] 027/100 VUs  0m43.0s/2m00.0s

running (0m44.0s), 028/100 VUs, 267 complete and 0 interrupted iterations
default   [  37% ] 028/100 VUs  0m44.0s/2m00.0s

running (0m45.0s), 029/100 VUs, 274 complete and 0 interrupted iterations
default   [  37% ] 029/100 VUs  0m45.0s/2m00.0s

running (0m46.0s), 031/100 VUs, 283 complete and 0 interrupted iterations
default   [  38% ] 031/100 VUs  0m46.0s/2m00.0s

running (0m47.0s), 032/100 VUs, 291 complete and 0 interrupted iterations
default   [  39% ] 032/100 VUs  0m47.0s/2m00.0s

running (0m48.0s), 033/100 VUs, 317 complete and 0 interrupted iterations
default   [  40% ] 033/100 VUs  0m48.0s/2m00.0s

running (0m49.0s), 035/100 VUs, 322 complete and 0 interrupted iterations
default   [  41% ] 035/100 VUs  0m49.0s/2m00.0s

running (0m50.0s), 036/100 VUs, 324 complete and 0 interrupted iterations
default   [  42% ] 036/100 VUs  0m50.0s/2m00.0s

running (0m51.0s), 037/100 VUs, 332 complete and 0 interrupted iterations
default   [  42% ] 037/100 VUs  0m51.0s/2m00.0s

running (0m52.0s), 039/100 VUs, 340 complete and 0 interrupted iterations
default   [  43% ] 039/100 VUs  0m52.0s/2m00.0s

running (0m53.0s), 040/100 VUs, 352 complete and 0 interrupted iterations
default   [  44% ] 040/100 VUs  0m53.0s/2m00.0s

running (0m54.0s), 041/100 VUs, 367 complete and 0 interrupted iterations
default   [  45% ] 041/100 VUs  0m54.0s/2m00.0s

running (0m55.0s), 043/100 VUs, 375 complete and 0 interrupted iterations
default   [  46% ] 043/100 VUs  0m55.0s/2m00.0s

running (0m56.0s), 044/100 VUs, 392 complete and 0 interrupted iterations
default   [  47% ] 044/100 VUs  0m56.0s/2m00.0s

running (0m57.0s), 045/100 VUs, 401 complete and 0 interrupted iterations
default   [  47% ] 045/100 VUs  0m57.0s/2m00.0s

running (0m58.0s), 047/100 VUs, 406 complete and 0 interrupted iterations
default   [  48% ] 047/100 VUs  0m58.0s/2m00.0s

running (0m59.0s), 048/100 VUs, 417 complete and 0 interrupted iterations
default   [  49% ] 048/100 VUs  0m59.0s/2m00.0s

running (1m00.0s), 049/100 VUs, 426 complete and 0 interrupted iterations
default   [  50% ] 049/100 VUs  1m00.0s/2m00.0s

running (1m01.0s), 051/100 VUs, 448 complete and 0 interrupted iterations
default   [  51% ] 051/100 VUs  1m01.0s/2m00.0s

running (1m02.0s), 053/100 VUs, 456 complete and 0 interrupted iterations
default   [  52% ] 053/100 VUs  1m02.0s/2m00.0s

running (1m03.0s), 054/100 VUs, 462 complete and 0 interrupted iterations
default   [  52% ] 054/100 VUs  1m03.0s/2m00.0s

running (1m04.0s), 056/100 VUs, 475 complete and 0 interrupted iterations
default   [  53% ] 056/100 VUs  1m04.0s/2m00.0s

running (1m05.0s), 058/100 VUs, 480 complete and 0 interrupted iterations
default   [  54% ] 058/100 VUs  1m05.0s/2m00.0s

running (1m06.0s), 059/100 VUs, 487 complete and 0 interrupted iterations
default   [  55% ] 059/100 VUs  1m06.0s/2m00.0s

running (1m07.0s), 061/100 VUs, 493 complete and 0 interrupted iterations
default   [  56% ] 061/100 VUs  1m07.0s/2m00.0s

running (1m08.0s), 063/100 VUs, 504 complete and 0 interrupted iterations
default   [  57% ] 063/100 VUs  1m08.0s/2m00.0s

running (1m09.0s), 064/100 VUs, 510 complete and 0 interrupted iterations
default   [  57% ] 064/100 VUs  1m09.0s/2m00.0s

running (1m10.0s), 066/100 VUs, 517 complete and 0 interrupted iterations
default   [  58% ] 066/100 VUs  1m10.0s/2m00.0s

running (1m11.0s), 068/100 VUs, 525 complete and 0 interrupted iterations
default   [  59% ] 068/100 VUs  1m11.0s/2m00.0s

running (1m12.0s), 069/100 VUs, 526 complete and 0 interrupted iterations
default   [  60% ] 069/100 VUs  1m12.0s/2m00.0s

running (1m13.0s), 071/100 VUs, 543 complete and 0 interrupted iterations
default   [  61% ] 071/100 VUs  1m13.0s/2m00.0s

running (1m14.0s), 073/100 VUs, 551 complete and 0 interrupted iterations
default   [  62% ] 073/100 VUs  1m14.0s/2m00.0s

running (1m15.0s), 074/100 VUs, 551 complete and 0 interrupted iterations
default   [  62% ] 074/100 VUs  1m15.0s/2m00.0s

running (1m16.0s), 076/100 VUs, 551 complete and 0 interrupted iterations
default   [  63% ] 076/100 VUs  1m16.0s/2m00.0s

running (1m17.0s), 078/100 VUs, 551 complete and 0 interrupted iterations
default   [  64% ] 078/100 VUs  1m17.0s/2m00.0s

running (1m18.0s), 079/100 VUs, 551 complete and 0 interrupted iterations
default   [  65% ] 079/100 VUs  1m18.0s/2m00.0s

running (1m19.0s), 081/100 VUs, 551 complete and 0 interrupted iterations
default   [  66% ] 081/100 VUs  1m19.0s/2m00.0s

running (1m20.0s), 083/100 VUs, 551 complete and 0 interrupted iterations
default   [  67% ] 083/100 VUs  1m20.0s/2m00.0s

running (1m21.0s), 084/100 VUs, 551 complete and 0 interrupted iterations
default   [  67% ] 084/100 VUs  1m21.0s/2m00.0s

running (1m22.0s), 086/100 VUs, 551 complete and 0 interrupted iterations
default   [  68% ] 086/100 VUs  1m22.0s/2m00.0s

running (1m23.0s), 088/100 VUs, 551 complete and 0 interrupted iterations
default   [  69% ] 088/100 VUs  1m23.0s/2m00.0s

running (1m24.0s), 089/100 VUs, 551 complete and 0 interrupted iterations
default   [  70% ] 089/100 VUs  1m24.0s/2m00.0s

running (1m25.0s), 091/100 VUs, 551 complete and 0 interrupted iterations
default   [  71% ] 091/100 VUs  1m25.0s/2m00.0s

running (1m26.0s), 093/100 VUs, 551 complete and 0 interrupted iterations
default   [  72% ] 093/100 VUs  1m26.0s/2m00.0s

running (1m27.0s), 094/100 VUs, 551 complete and 0 interrupted iterations
default   [  72% ] 094/100 VUs  1m27.0s/2m00.0s

running (1m28.0s), 096/100 VUs, 551 complete and 0 interrupted iterations
default   [  73% ] 096/100 VUs  1m28.0s/2m00.0s

running (1m29.0s), 098/100 VUs, 551 complete and 0 interrupted iterations
default   [  74% ] 098/100 VUs  1m29.0s/2m00.0s

running (1m30.0s), 099/100 VUs, 551 complete and 0 interrupted iterations
default   [  75% ] 099/100 VUs  1m30.0s/2m00.0s

running (1m31.0s), 100/100 VUs, 551 complete and 0 interrupted iterations
default   [  76% ] 100/100 VUs  1m31.0s/2m00.0s

running (1m32.0s), 100/100 VUs, 551 complete and 0 interrupted iterations
default   [  77% ] 100/100 VUs  1m32.0s/2m00.0s

running (1m33.0s), 100/100 VUs, 551 complete and 0 interrupted iterations
default   [  77% ] 100/100 VUs  1m33.0s/2m00.0s

running (1m34.0s), 100/100 VUs, 551 complete and 0 interrupted iterations
default   [  78% ] 100/100 VUs  1m34.0s/2m00.0s

running (1m35.0s), 100/100 VUs, 551 complete and 0 interrupted iterations
default   [  79% ] 100/100 VUs  1m35.0s/2m00.0s

running (1m36.0s), 100/100 VUs, 551 complete and 0 interrupted iterations
default   [  80% ] 100/100 VUs  1m36.0s/2m00.0s

running (1m37.0s), 100/100 VUs, 551 complete and 0 interrupted iterations
default   [  81% ] 100/100 VUs  1m37.0s/2m00.0s

running (1m38.0s), 100/100 VUs, 551 complete and 0 interrupted iterations
default   [  82% ] 100/100 VUs  1m38.0s/2m00.0s

running (1m39.0s), 100/100 VUs, 551 complete and 0 interrupted iterations
default   [  82% ] 100/100 VUs  1m39.0s/2m00.0s

running (1m40.0s), 100/100 VUs, 551 complete and 0 interrupted iterations
default   [  83% ] 100/100 VUs  1m40.0s/2m00.0s

running (1m41.0s), 100/100 VUs, 551 complete and 0 interrupted iterations
default   [  84% ] 100/100 VUs  1m41.0s/2m00.0s

running (1m42.0s), 099/100 VUs, 563 complete and 0 interrupted iterations
default   [  85% ] 099/100 VUs  1m42.0s/2m00.0s

running (1m43.0s), 098/100 VUs, 568 complete and 0 interrupted iterations
default   [  86% ] 098/100 VUs  1m43.0s/2m00.0s

running (1m44.0s), 097/100 VUs, 572 complete and 0 interrupted iterations
default   [  87% ] 097/100 VUs  1m44.0s/2m00.0s

running (1m45.0s), 097/100 VUs, 576 complete and 0 interrupted iterations
default   [  87% ] 097/100 VUs  1m45.0s/2m00.0s

running (1m46.0s), 097/100 VUs, 576 complete and 0 interrupted iterations
default   [  88% ] 097/100 VUs  1m46.0s/2m00.0s

running (1m47.0s), 097/100 VUs, 576 complete and 0 interrupted iterations
default   [  89% ] 097/100 VUs  1m47.0s/2m00.0s

running (1m48.0s), 097/100 VUs, 576 complete and 0 interrupted iterations
default   [  90% ] 097/100 VUs  1m48.0s/2m00.0s

running (1m49.0s), 097/100 VUs, 576 complete and 0 interrupted iterations
default   [  91% ] 097/100 VUs  1m49.0s/2m00.0s

running (1m50.0s), 097/100 VUs, 576 complete and 0 interrupted iterations
default   [  92% ] 097/100 VUs  1m50.0s/2m00.0s

running (1m51.0s), 097/100 VUs, 576 complete and 0 interrupted iterations
default   [  92% ] 097/100 VUs  1m51.0s/2m00.0s

running (1m52.0s), 097/100 VUs, 576 complete and 0 interrupted iterations
default   [  93% ] 097/100 VUs  1m52.0s/2m00.0s

running (1m53.0s), 097/100 VUs, 576 complete and 0 interrupted iterations
default   [  94% ] 097/100 VUs  1m53.0s/2m00.0s

running (1m54.0s), 097/100 VUs, 576 complete and 0 interrupted iterations
default   [  95% ] 097/100 VUs  1m54.0s/2m00.0s

running (1m55.0s), 097/100 VUs, 576 complete and 0 interrupted iterations
default   [  96% ] 097/100 VUs  1m55.0s/2m00.0s

running (1m56.0s), 097/100 VUs, 576 complete and 0 interrupted iterations
default   [  97% ] 097/100 VUs  1m56.0s/2m00.0s

running (1m57.0s), 097/100 VUs, 576 complete and 0 interrupted iterations
default   [  97% ] 097/100 VUs  1m57.0s/2m00.0s

running (1m58.0s), 097/100 VUs, 576 complete and 0 interrupted iterations
default   [  98% ] 097/100 VUs  1m58.0s/2m00.0s

running (1m59.0s), 097/100 VUs, 576 complete and 0 interrupted iterations
default   [  99% ] 097/100 VUs  1m59.0s/2m00.0s

running (2m00.0s), 097/100 VUs, 576 complete and 0 interrupted iterations
default   [ 100% ] 097/100 VUs  2m00.0s/2m00.0s

running (2m01.0s), 094/100 VUs, 576 complete and 3 interrupted iterations
default ↓ [ 100% ] 097/100 VUs  2m0s

running (2m02.0s), 091/100 VUs, 576 complete and 6 interrupted iterations
default ↓ [ 100% ] 097/100 VUs  2m0s

running (2m03.0s), 088/100 VUs, 576 complete and 9 interrupted iterations
default ↓ [ 100% ] 097/100 VUs  2m0s

running (2m04.0s), 084/100 VUs, 576 complete and 13 interrupted iterations
default ↓ [ 100% ] 097/100 VUs  2m0s

running (2m05.0s), 081/100 VUs, 576 complete and 16 interrupted iterations
default ↓ [ 100% ] 097/100 VUs  2m0s

running (2m06.0s), 078/100 VUs, 576 complete and 19 interrupted iterations
default ↓ [ 100% ] 097/100 VUs  2m0s

running (2m07.0s), 074/100 VUs, 576 complete and 23 interrupted iterations
default ↓ [ 100% ] 097/100 VUs  2m0s

running (2m08.0s), 071/100 VUs, 576 complete and 26 interrupted iterations
default ↓ [ 100% ] 097/100 VUs  2m0s

running (2m09.0s), 068/100 VUs, 576 complete and 29 interrupted iterations
default ↓ [ 100% ] 097/100 VUs  2m0s

running (2m10.0s), 064/100 VUs, 576 complete and 33 interrupted iterations
default ↓ [ 100% ] 097/100 VUs  2m0s

running (2m11.0s), 061/100 VUs, 577 complete and 35 interrupted iterations
default ↓ [ 100% ] 097/100 VUs  2m0s

running (2m12.0s), 058/100 VUs, 579 complete and 36 interrupted iterations
default ↓ [ 100% ] 097/100 VUs  2m0s

running (2m13.0s), 048/100 VUs, 585 complete and 40 interrupted iterations
default ↓ [ 100% ] 097/100 VUs  2m0s

running (2m14.0s), 046/100 VUs, 585 complete and 42 interrupted iterations
default ↓ [ 100% ] 097/100 VUs  2m0s

running (2m15.0s), 043/100 VUs, 585 complete and 45 interrupted iterations
default ↓ [ 100% ] 097/100 VUs  2m0s

running (2m16.0s), 039/100 VUs, 585 complete and 49 interrupted iterations
default ↓ [ 100% ] 097/100 VUs  2m0s

running (2m17.0s), 037/100 VUs, 585 complete and 51 interrupted iterations
default ↓ [ 100% ] 097/100 VUs  2m0s

running (2m18.0s), 035/100 VUs, 585 complete and 53 interrupted iterations
default ↓ [ 100% ] 097/100 VUs  2m0s

running (2m19.0s), 032/100 VUs, 585 complete and 56 interrupted iterations
default ↓ [ 100% ] 097/100 VUs  2m0s

running (2m20.0s), 029/100 VUs, 585 complete and 59 interrupted iterations
default ↓ [ 100% ] 097/100 VUs  2m0s

running (2m21.0s), 027/100 VUs, 585 complete and 61 interrupted iterations
default ↓ [ 100% ] 097/100 VUs  2m0s

running (2m22.0s), 024/100 VUs, 585 complete and 64 interrupted iterations
default ↓ [ 100% ] 097/100 VUs  2m0s

running (2m23.0s), 022/100 VUs, 585 complete and 66 interrupted iterations
default ↓ [ 100% ] 097/100 VUs  2m0s

running (2m24.0s), 019/100 VUs, 585 complete and 69 interrupted iterations
default ↓ [ 100% ] 097/100 VUs  2m0s

running (2m25.0s), 015/100 VUs, 585 complete and 73 interrupted iterations
default ↓ [ 100% ] 097/100 VUs  2m0s

running (2m26.0s), 013/100 VUs, 585 complete and 75 interrupted iterations
default ↓ [ 100% ] 097/100 VUs  2m0s

running (2m27.0s), 010/100 VUs, 585 complete and 78 interrupted iterations
default ↓ [ 100% ] 097/100 VUs  2m0s

running (2m28.0s), 006/100 VUs, 585 complete and 82 interrupted iterations
default ↓ [ 100% ] 097/100 VUs  2m0s

running (2m29.0s), 004/100 VUs, 585 complete and 84 interrupted iterations
default ↓ [ 100% ] 097/100 VUs  2m0s

running (2m30.0s), 001/100 VUs, 585 complete and 87 interrupted iterations
default ↓ [ 100% ] 097/100 VUs  2m0s


  █ TOTAL RESULTS 

    HTTP
    http_req_duration..............: avg=1.63s min=361.53µs med=18.41ms max=1m0s   p(90)=2.14s p(95)=4.56s 
      { expected_response:true }...: avg=1.21s min=361.53µs med=17.18ms max=59.43s p(90)=1.84s p(95)=3.28s 
    http_req_failed................: 1.32%  42 out of 3160
    http_reqs......................: 3160   21.066528/s

    EXECUTION
    iteration_duration.............: avg=5.21s min=1.08s    med=2.31s   max=1m4s   p(90)=7.53s p(95)=33.92s
    iterations.....................: 585    3.899974/s
    vus............................: 1      min=1          max=100
    vus_max........................: 100    min=100        max=100

    NETWORK
    data_received..................: 169 MB 1.1 MB/s
    data_sent......................: 447 kB 3.0 kB/s




running (2m30.0s), 000/100 VUs, 585 complete and 88 interrupted iterations
default ✓ [ 100% ] 001/100 VUs  2m0s
